<!ELEMENT observations (observation*)>
<!ELEMENT observation (id, YEAR, lieu, espece, NBR)>
<!ELEMENT id (#PCDATA)>
<!ELEMENT lieu (id, nom, position)>
<!ELEMENT espece (nom, id, description)>
<!ELEMENT NBR (#PCDATA)>
<!ELEMENT position (X, Y)>
<!ELEMENT X (#PCDATA)>
<!ELEMENT Y (#PCDATA)>
<!ELEMENT YEAR   (#PCDATA)>
<!ELEMENT description   (#PCDATA)>

